[
  {
    "handle": "cone-brewer",
    "title": {
      "en": "Cone Brewer",
      "de": "Kegelfilter aus Keramik"
    },
    "description": {
      "en": "A considered start to your morning. Ridges keep the paper lifted so water flows evenly. Choose 01 for one cup or 02 when you are brewing for two.",
      "de": "Ein ruhiger Start in den Morgen. Rippen halten das Papier auf Abstand, damit Wasser gleichmäßig fließt. Wähle 01 für eine Tasse oder 02 für zwei."
    },
    "group": "Brewers",
    "material": {
      "en": "Ceramic",
      "de": "Keramik"
    },
    "methods": ["pour-over"],
    "beginner": true,
    "guide": "a-calm-pour-over",
    "excludeCountries": [],
    "care": {
      "en": "Rinse after use and dry thoroughly. Hand washing is recommended for this demonstration product.",
      "de": "Nach Gebrauch spülen und gründlich trocknen. Für dieses Demonstrationsprodukt wird Handwäsche empfohlen."
    },
    "media": [
      {
        "file": "design/assets/cone-brewer.webp",
        "alt": {
          "en": "Cone Brewer — original illustrative product photograph",
          "de": "Kegelfilter aus Keramik – ursprüngliches beispielhaftes Produktfoto"
        }
      }
    ],
    "options": [
      {
        "name": "Size",
        "de": "Größe",
        "values": ["01 · 250 ml", "02 · 500 ml"]
      },
      {
        "name": "Finish",
        "de": "Farbe",
        "values": ["Chalk", "Olive"],
        "translations": {
          "Chalk": "Kreide",
          "Olive": "Oliv"
        }
      }
    ],
    "variants": [
      {
        "sku": "BB-CONE-01-CHALK",
        "options": ["01 · 250 ml", "Chalk"],
        "price": "32.00",
        "weightGrams": 300,
        "capacityMl": 250,
        "initialStock": 30,
        "compatibleSkus": ["BB-16-STD"]
      },
      {
        "sku": "BB-CONE-01-OLIVE",
        "options": ["01 · 250 ml", "Olive"],
        "price": "32.00",
        "weightGrams": 300,
        "capacityMl": 250,
        "initialStock": 0,
        "compatibleSkus": ["BB-16-STD"]
      },
      {
        "sku": "BB-CONE-02-CHALK",
        "options": ["02 · 500 ml", "Chalk"],
        "price": "38.00",
        "weightGrams": 400,
        "capacityMl": 500,
        "initialStock": 30,
        "compatibleSkus": ["BB-17-STD", "BB-19-STD"]
      }
    ]
  },
  {
    "handle": "flatbed-brewer",
    "title": {
      "en": "Flatbed Brewer",
      "de": "Flachbodenfilter"
    },
    "description": {
      "en": "A flat bed, a steady pour, a balanced cup. The wide base makes this a forgiving way to explore hand brewing. Uses our flatbed paper filters.",
      "de": "Flacher Boden, ruhiger Aufguss, ausgewogener Kaffee. Die breite Basis erleichtert den Einstieg. Passend zu unseren Flachboden-Papierfiltern."
    },
    "group": "Brewers",
    "material": {
      "en": "Ceramic",
      "de": "Keramik"
    },
    "methods": ["pour-over"],
    "beginner": true,
    "guide": "a-calm-pour-over",
    "excludeCountries": [],
    "care": {
      "en": "Rinse after use and dry thoroughly. Hand washing is recommended for this demonstration product.",
      "de": "Nach Gebrauch spülen und gründlich trocknen. Für dieses Demonstrationsprodukt wird Handwäsche empfohlen."
    },
    "media": [
      {
        "file": "design/assets/flatbed-brewer.webp",
        "alt": {
          "en": "Flatbed Brewer — original illustrative product photograph",
          "de": "Flachbodenfilter – ursprüngliches beispielhaftes Produktfoto"
        }
      }
    ],
    "options": [
      {
        "name": "Size",
        "de": "Größe",
        "values": ["400 ml"]
      }
    ],
    "variants": [
      {
        "sku": "BB-02-STD",
        "options": ["400 ml"],
        "price": "36.00",
        "weightGrams": 500,
        "capacityMl": 400,
        "initialStock": 30,
        "compatibleSkus": ["BB-18-STD"]
      }
    ]
  },
  {
    "handle": "immersion-brewer",
    "title": {
      "en": "Immersion Brewer",
      "de": "Immersionsfilter"
    },
    "description": {
      "en": "Let your coffee steep, then open the valve. Immersion brewing offers a simple routine with less attention to pouring technique.",
      "de": "Kaffee ziehen lassen, dann das Ventil öffnen. Immersion bietet eine einfache Routine, bei der die Gießtechnik weniger wichtig ist."
    },
    "group": "Brewers",
    "material": {
      "en": "Tritan and silicone",
      "de": "Tritan und Silikon"
    },
    "methods": ["immersion"],
    "beginner": true,
    "guide": null,
    "excludeCountries": [],
    "care": {
      "en": "Rinse after use and dry thoroughly. Hand washing is recommended for this demonstration product.",
      "de": "Nach Gebrauch spülen und gründlich trocknen. Für dieses Demonstrationsprodukt wird Handwäsche empfohlen."
    },
    "media": [
      {
        "file": "design/assets/immersion-brewer.webp",
        "alt": {
          "en": "Immersion Brewer — original illustrative product photograph",
          "de": "Immersionsfilter – ursprüngliches beispielhaftes Produktfoto"
        }
      }
    ],
    "options": [
      {
        "name": "Size",
        "de": "Größe",
        "values": ["450 ml"]
      }
    ],
    "variants": [
      {
        "sku": "BB-03-STD",
        "options": ["450 ml"],
        "price": "42.00",
        "weightGrams": 500,
        "capacityMl": 450,
        "initialStock": 30,
        "compatibleSkus": ["BB-17-STD", "BB-21-STD"]
      }
    ]
  },
  {
    "handle": "french-press",
    "title": {
      "en": "French Press",
      "de": "French Press"
    },
    "description": {
      "en": "Full-bodied coffee, without paper. A simple glass vessel lets you see the brew, while the replaceable mesh keeps this everyday tool useful.",
      "de": "Vollmundiger Kaffee ohne Papier. Im Glas lässt sich der Aufguss beobachten. Das austauschbare Sieb macht die Kanne zum langlebigen Alltagsbegleiter."
    },
    "group": "Brewers",
    "material": {
      "en": "Glass and stainless steel",
      "de": "Glas und Edelstahl"
    },
    "methods": ["immersion"],
    "beginner": true,
    "guide": null,
    "excludeCountries": [],
    "care": {
      "en": "Rinse after use and dry thoroughly. Hand washing is recommended for this demonstration product.",
      "de": "Nach Gebrauch spülen und gründlich trocknen. Für dieses Demonstrationsprodukt wird Handwäsche empfohlen."
    },
    "media": [
      {
        "file": "design/assets/french-press.webp",
        "alt": {
          "en": "French Press — original illustrative product photograph",
          "de": "French Press – ursprüngliches beispielhaftes Produktfoto"
        }
      }
    ],
    "options": [
      {
        "name": "Size",
        "de": "Größe",
        "values": ["600 ml"]
      }
    ],
    "variants": [
      {
        "sku": "BB-04-STD",
        "options": ["600 ml"],
        "price": "49.00",
        "weightGrams": 500,
        "capacityMl": 600,
        "initialStock": 30,
        "compatibleSkus": ["BB-20-STD", "BB-24-STD"]
      }
    ]
  },
  {
    "handle": "travel-brewer",
    "title": {
      "en": "Travel Brewer",
      "de": "Kompakter Reise-Kaffeebereiter für kleine Küchen und unterwegs"
    },
    "description": {
      "en": "A compact press for a good cup away from your usual counter. Packs down small and rinses clean in moments.",
      "de": "Eine kompakte Presse für guten Kaffee abseits deiner Küche. Klein verstaubar und in wenigen Handgriffen gereinigt."
    },
    "group": "Brewers",
    "material": {
      "en": "Polypropylene",
      "de": "Polypropylen"
    },
    "methods": ["travel"],
    "beginner": false,
    "guide": null,
    "excludeCountries": [],
    "care": {
      "en": "Rinse after use and dry thoroughly. Hand washing is recommended for this demonstration product.",
      "de": "Nach Gebrauch spülen und gründlich trocknen. Für dieses Demonstrationsprodukt wird Handwäsche empfohlen."
    },
    "media": [
      {
        "file": "design/assets/travel-brewer.webp",
        "alt": {
          "en": "Travel Brewer — original illustrative product photograph",
          "de": "Kompakter Reise-Kaffeebereiter für kleine Küchen und unterwegs – ursprüngliches beispielhaftes Produktfoto"
        }
      }
    ],
    "options": [
      {
        "name": "Size",
        "de": "Größe",
        "values": ["250 ml"]
      }
    ],
    "variants": [
      {
        "sku": "BB-05-STD",
        "options": ["250 ml"],
        "price": "38.00",
        "weightGrams": 500,
        "capacityMl": 250,
        "initialStock": 30,
        "compatibleSkus": []
      }
    ]
  },
  {
    "handle": "burr-hand-grinder",
    "title": {
      "en": "Burr Hand Grinder",
      "de": "Handmühle mit Kegelmahlwerk"
    },
    "description": {
      "en": "Freshly ground, at your own pace. A stainless burr set and stepped adjustment help you repeat your favourite recipe. 25 g bean capacity.",
      "de": "Frisch gemahlen im eigenen Tempo. Edelstahlmahlwerk und Rasterverstellung helfen dir, dein Lieblingsrezept zu wiederholen. Platz für 25 g Bohnen."
    },
    "group": "Grinders",
    "material": {
      "en": "Stainless steel",
      "de": "Edelstahl"
    },
    "methods": ["pour-over", "immersion"],
    "beginner": true,
    "guide": null,
    "excludeCountries": [],
    "care": {
      "en": "Brush dry after use. Do not immerse the burr mechanism in water.",
      "de": "Nach Gebrauch trocken ausbürsten. Das Mahlwerk nicht in Wasser tauchen."
    },
    "media": [
      {
        "file": "design/assets/burr-hand-grinder.webp",
        "alt": {
          "en": "Burr Hand Grinder — original illustrative product photograph",
          "de": "Handmühle mit Kegelmahlwerk – ursprüngliches beispielhaftes Produktfoto"
        }
      }
    ],
    "options": [
      {
        "name": "Size",
        "de": "Größe",
        "values": ["Standard"]
      }
    ],
    "variants": [
      {
        "sku": "BB-06-STD",
        "options": ["Standard"],
        "price": "79.00",